고객코드,고객명,성별,나이,직업,주소,취미,핸드폰번호,학력,키,몸무게,주사용SNS,주사용채널,주사용OTT
72856,김현지,여성,26,전산 자료 입력원 및 사무 보조원,울산광역시 양천구 강남대849거리,영화 감상,(010)82480484,박사,187.56,78.51,인스타그램,YouTube,넷플릭스
82019,장지후,남성,26,보일러 설치 및 정비원,세종특별자치시 강남구 반포대거리,요리,(010)97426888,고졸,156.77,91.08,트위터,포털,왓챠
99439,이경희,남성,30,측량 및 지리정보 전문가,강원도 의왕시 도산대로 (민지최읍),요리,(010)09120074,고졸,188.03,50.38,페이스북,YouTube,웨이브
17784,허예은,여성,26,소방공학 기술자 및 연구원,경상남도 청주시 청원구 테헤란길 (하윤김면),여행,(010)90774355,석사,161.33,92.17,트위터,포털,왓챠
51692,이성호,남성,33,패션 디자이너,인천광역시 종로구 선릉길 (수민이이마을),요리,(010)59846486,대졸,183.68,99.48,틱톡,포털,티빙
9313,최민서,남성,47,보험 및 금융 상품 개발자,대전광역시 중구 학동길,등산,(010)11705264,박사,175.68,75.88,인스타그램,YouTube,티빙
74429,문지원,여성,64,의회의원/고위공무원 및 공공단체임원,제주특별자치도 하남시 석촌호수가 (정희김박읍),여행,(010)99711788,대졸,159.88,43.21,인스타그램,블로그,티빙
57582,이지우,여성,37,보건의료관련 관리자,경상남도 태백시 잠실거리,요리,(010)60006629,박사,162.24,70.79,페이스북,YouTube,왓챠
98448,권승민,여성,40,고무 및 플라스틱 제품 조립원,충청북도 안양시 만안구 역삼32가,독서,(010)67186246,대졸,155.17,51.74,틱톡,블로그,티빙
46255,윤은경,여성,62,펄프 및 종이 제조장치 조작원,전라북도 수원시 영통구 서초중앙가 (지원김김마을),요리,(010)66765298,대졸,186.94,81.1,트위터,YouTube,넷플릭스
1624,이은서,남성,32,텔레마케터,경상북도 인제군 잠실거리,요리,(010)36260578,고졸,159.93,53.99,인스타그램,포털,티빙
9517,황수빈,남성,29,기타 직물 및 신발 관련 기계조작원 및 조립원,충청남도 시흥시 반포대길 (광수엄동),독서,(010)44607633,대졸,152.87,81.23,페이스북,포털,왓챠
23112,박현정,남성,31,유리제조 및 가공기 조작원,전라남도 안양시 동안구 삼성거리,등산,(010)88004762,박사,156.12,84.75,트위터,YouTube,웨이브
35968,강진호,여성,39,전기/가스 및 수도 관련 관리자,세종특별자치시 강남구 테헤란7로 (은정박읍),독서,(010)32326116,석사,171.59,58.93,인스타그램,블로그,티빙
2669,이수진,남성,20,기타 경호 및 보안 관련 종사원,광주광역시 강북구 언주길 (하은오읍),등산,(010)34162324,박사,160.8,50.49,틱톡,YouTube,티빙
3260,김지연,남성,23,기타 식품가공관련 기계조작원,인천광역시 동작구 잠실730로,영화 감상,(010)79611309,박사,173.29,65.98,인스타그램,YouTube,넷플릭스
35472,박옥자,남성,20,점토제품 생산기 조작원,강원도 서산시 역삼7로 (시우김이리),여행,(010)49495836,대졸,167.47,86.11,틱톡,블로그,웨이브
48922,김도현,남성,48,판금원,경기도 강릉시 석촌호수로 (채원배황마을),요리,(010)93845964,대졸,160.47,74.92,페이스북,포털,티빙
25684,김지아,여성,39,상품중개인 및 경매사,제주특별자치도 이천시 압구정4거리 (영미이리),독서,(010)29183779,고졸,176.94,78.25,인스타그램,블로그,티빙
58417,박하은,여성,35,기타 식품가공관련 기계조작원,전라북도 정선군 언주로 (성민김리),독서,(010)02867366,대졸,175.26,45.52,페이스북,YouTube,티빙
78095,안보람,남성,64,석유 및 천연가스제조 관련 제어장치 조작원,대전광역시 동대문구 도산대가 (준영이면),요리,(010)48740415,고졸,165.53,60.89,틱톡,YouTube,티빙
49796,문광수,남성,48,바닥재 시공원,서울특별시 관악구 논현길,여행,(010)93197157,박사,187.19,43.36,페이스북,YouTube,넷플릭스
79220,송영환,여성,61,연예인 및 스포츠 매니저,전라북도 구리시 봉은사거리 (지은권서마을),등산,(010)73387831,석사,154.79,40.34,페이스북,YouTube,왓챠
18989,김은서,남성,36,관세행정 사무원,울산광역시 서대문구 도산대거리 (민재김리),여행,(010)35855628,석사,164.08,64.73,트위터,블로그,왓챠
13332,김영식,여성,52,패션 디자이너,대전광역시 성북구 개포28길 (승현서김마을),여행,(010)74202679,박사,151.25,98.27,인스타그램,YouTube,웨이브
50103,서아름,남성,63,컴퓨터시스템 설계 및 분석가,부산광역시 강동구 개포073거리 (서연김동),여행,(010)66515973,대졸,169.99,58.07,페이스북,블로그,웨이브
25608,남수진,여성,61,강구조물 가공원 및 건립원,경상북도 고양시 일산서구 선릉거리,여행,(010)17268836,박사,184.81,88.45,인스타그램,블로그,티빙
89655,김아름,여성,35,지휘자/작곡가 및 연주가,경상남도 청주시 상당구 백제고분2가 (예은김이리),요리,(010)17873208,고졸,172.39,74.36,인스타그램,포털,왓챠
63725,김성수,여성,49,보험 심사원 및 사무원,부산광역시 용산구 서초대5가,독서,(010)83150301,대졸,159.77,75.47,트위터,블로그,티빙
38118,김영자,남성,60,구두 미화원,경기도 오산시 테헤란로,요리,(010)90213357,고졸,177.34,43.89,트위터,포털,웨이브
68782,박은지,여성,61,부동산 컨설턴트 및 중개인,세종특별자치시 은평구 잠실거리 (민석김허마을),등산,(010)57134695,박사,178.36,81.61,트위터,포털,티빙
24057,김동현,남성,33,상담 전문가 및 청소년 지도사,강원도 연천군 언주2가,독서,(010)24445532,박사,189.0,98.47,트위터,YouTube,티빙
27343,양성호,남성,44,정부행정 관리자,경상북도 속초시 반포대4로,등산,(010)32076931,박사,167.51,92.81,트위터,포털,넷플릭스
83099,김민지,남성,26,대학 시간강사,충청북도 가평군 영동대로 (지아이읍),영화 감상,(010)40479255,대졸,163.05,52.91,틱톡,포털,티빙
63143,오상훈,여성,27,기타 건설관련 기능 종사원,충청남도 태백시 언주186길 (영철안조면),독서,(010)95393229,대졸,161.95,72.97,인스타그램,포털,티빙
50124,최지영,여성,51,용접기 조작원,광주광역시 강남구 가락가,독서,(010)64654774,석사,184.26,87.07,인스타그램,YouTube,웨이브
98428,한영자,여성,40,자동차 정비원,광주광역시 양천구 삼성873길 (옥순김김읍),등산,(010)15470340,석사,164.82,48.6,페이스북,YouTube,티빙
3176,안보람,여성,48,기타 음식서비스 종사원,전라북도 보령시 역삼가 (지혜김리),독서,(010)78597987,석사,155.17,60.37,인스타그램,블로그,티빙
71048,한보람,남성,41,숙박/여행/오락 및 스포츠 관련 관리자,광주광역시 광진구 서초대거리 (서윤나이동),여행,(010)76141324,고졸,154.11,68.9,트위터,포털,티빙
45641,김주원,여성,53,의회의원/고위공무원 및 공공단체임원,경기도 수원시 팔달구 개포가 (현우이마을),등산,(010)65550853,박사,179.93,60.78,트위터,YouTube,왓챠
48951,김상호,남성,50,응용 소프트웨어 개발자,강원도 단양군 영동대631로,영화 감상,(010)09144662,박사,156.15,63.31,틱톡,블로그,넷플릭스
18335,김준혁,여성,63,실내장식 디자이너,세종특별자치시 종로구 학동가,영화 감상,(010)39819445,대졸,187.94,49.67,인스타그램,YouTube,넷플릭스
71920,김영희,남성,50,숙박시설 서비스원,부산광역시 서대문구 잠실로 (수진손강동),영화 감상,(010)86806776,박사,168.6,89.25,틱톡,포털,넷플릭스
23104,김상현,남성,42,유리제조 및 가공기 조작원,제주특별자치도 수원시 영통구 선릉594로,영화 감상,(010)90871067,대졸,175.02,57.06,인스타그램,YouTube,왓챠
77514,임승민,여성,31,조세행정 사무원,충청북도 양양군 가락길 (혜진신이읍),요리,(010)43000120,대졸,187.11,57.42,페이스북,블로그,왓챠
46143,박정웅,여성,49,촬영기사,부산광역시 강동구 압구정451가,요리,(010)11477542,대졸,177.21,45.39,페이스북,YouTube,왓챠
46391,이도현,남성,23,외선전공,충청남도 청주시 흥덕구 도산대로,등산,(010)11165748,박사,153.25,86.97,인스타그램,포털,왓챠
58887,김명자,여성,40,기타 문리/기술 및 예능 강사,경상북도 괴산군 반포대816가 (정식오면),요리,(010)56983503,석사,184.61,79.2,트위터,포털,넷플릭스
64994,양서영,남성,19,혼례 종사원,경기도 수원시 장안구 잠실로,등산,(010)59277599,석사,155.21,74.75,인스타그램,포털,왓챠
23757,박병철,여성,25,생산 및 품질 관리 사무원,서울특별시 서구 압구정가 (영희최마을),독서,(010)76001945,대졸,175.62,75.95,인스타그램,YouTube,티빙
85698,하종수,여성,65,홍보 도우미 및 판촉원,전라북도 하남시 도산대거리,등산,(010)66094244,박사,150.79,76.88,페이스북,YouTube,웨이브
62094,김서연,남성,36,전자공학 기술자 및 연구원,충청북도 화천군 도산대9가 (미경최허면),요리,(010)40671350,고졸,171.15,44.84,페이스북,YouTube,티빙
